,label,content
73,Real,"In series of tweets, Donald Trump defends his charitable foundation President-elect Donald Trump took to Twitter Monday night to defend his charitable foundation, the Donald J. Trump Foundation, just two days after announcing he will dissolve it.  In the posts, Mr. Trump says he gave millions of dollars to the Trump Foundation. He also said that all of the money goes to wonderful charities, a claim for which there is little to no evidence:  Follow Donald J. Trump ? @realDonaldTrump I gave millions of dollars to DJT Foundation, raised or recieved millions more, ALL of which is given to charity, and media won't report! 9:53 PM - 26 Dec 2016 15,531 15,531 Retweets   60,569 60,569 likes Follow Donald J. Trump ? @realDonaldTrump The DJT Foundation, unlike most foundations, never paid fees, rent, salaries or any expenses. 100% of money goes to wonderful charities! 10:06 PM - 26 Dec 2016 13,490 13,490 Retweets   57,105 57,105 likes Despite Mr. Trumps assertion that he has given millions of dollars to the Trump Foundation, news reports have indicated that Mr. Trump vastly oversells his charitable giving. And since he has not released his tax returns, its impossible to verify how much money he has given to charity.  According to the Washington Post, Mr. Trump has given only one traceable personal donation since 2008 -- for $10,000, to the Police Athletic League of New York City. As for the Trump Foundation, Mr. Trump has given $5.5 million to the group since its inception -- but has not contributed to it since 2008, meaning the organization has largely been funded by other people in recent years.  In addition, several reports have established that Mr. Trump used money from the foundation to help further his political interests. The Washington Post reported, for example, that Mr. Trump used foundation funds to settle legal disputes -- and even to buy two large portraits of himself, one of which hung on the wall of a Trump-owned golf resort. He paid a $2,500 fine to the Internal Revenue Service (IRS) earlier this year after it was revealed that his foundation made a $25,000 political contribution that violated tax laws.  The series of tweets came just two days after Mr. Trump announced he would be shuttering the foundation in the wake of questions about possible conflicts of interest.  Mr. Trump said in a Christmas Eve statement that he has directed his counsel to begin taking steps toward dissolving the foundation; however, it cannot formally shut down until the New York state attorney generals office completes its investigation of the foundation.  To avoid even the appearance of any conflict with my role as President I have decided to continue to pursue my strong interest in philanthropy in other ways, Mr. Trump said in his statement.  Mr. Trumps tweets about the Trump Foundation also came just hours after he insisted on Twitter that there was no way President Obama could have beaten him in a hypothetical 2016 election between the two men, and criticized the United Nations for not living up to its great potential."
74,Fake,"30-day warranty expires on Make America Great Again baseball caps The warranty on Make America Great Again baseball caps has expired 30 days after the US election, meaning they are now falling to bits with startling rapidity.  The hats enjoyed a brief vogue in the United States last month, which resulted in them being cheaply mass produced and shipped from China in huge numbers.  However, as a month has now passed the warranty has run out and the hats are already looking worn, frayed and cheap, although it has been named headgear of the year by Time magazine.  Purchasers have reported the peak falling off the cap, the colours rapidly fading, and the whole thing being revealed as an attractively marketed piece of tat designed to last only until voting was over.  Some of the letters done gone fell off of mah cap so now it just says Make Merica Eat Again, our correspondent Simon-Bob Williams told us.  Which sounds like plum humdiggity good advice to me. Its what I sure live mah life for.  Eee-lection? What are yall still talkin about that for? It was weeks ago!"
75,Real,"Senate Democrats plan to run their Trump playbook against Tillerson Congress is preparing to do major battle next month over President-elect Donald Trumps secretary-of-state nominee, Rex Tillerson, in a brewing proxy fight over Trumps potential financial conflicts of interest and his unconventional foreign policy.  The official sparring is expected to take place on Jan. 11, when the Senate Foreign Relations Committee plans to hold a two-part hearing to grill Tillerson over his tenure as ExxonMobils chief executive and what many lawmakers see as unseemly links to Russia.  But behind the scenes on Capitol Hill, the strategizing has already begun.  Democrats do not think they stand much chance of stopping Tillerson from being confirmed. But they plan to press the top diplomat-designate to commit to full divestiture from Exxon and detail how he would pursue a different approach to the world as secretary of state, in what one Senate Democratic aide who requested anonymity to candidly discuss strategy called a very thorough, tough vetting. As they have with Trump, Democrats plan to focus sharply on potential conflicts of interest deriving from Tillersons finances, as well as his views on critical foreign-policy matters.  Its a grilling they would happily give Trump, if only they had reason to drag him before a congressional committee.  Already, the minority party is railing against Republicans for refusing to demand Tillerson produce his tax returns. Their frustration stems from Tillersons response to a routine question about tax returns on the Foreign Relations Committees pre-hearing questionnaire. According to a Senate Democratic aide and a Trump transition team spokesman, Tillerson said he stood ready to provide only tax return information for himself and his wife for the previous three years. That means its possible Tillerson isnt willing to provide complete returns.   A battle is brewing over secretary of state-designate Rex Tillersons nomination on Capitol Hill. (Evan Vucci/AP) Democrats have demanded that all Trumps Cabinet nominees release their tax returns  something Trump himself steadfastly refused to do during the campaign, because, he said, the returns were under routine audit.  Foreign Relations Committee Chairman Bob Corker (R-Tenn.) said the GOP would not break with years of precedent to compel Tillerson to turn over his tax returns without good reason, no matter how loud the clamor from Democrats. Unless there was a case where theres some irregularity thats known, the committee just does not ask for tax returns, Corker said in an interview.  Corker said Tillerson is not going to be the proxy [for Trump], because were not going to ask for tax returns.  I understand there are a number of Democrats who are very upset about President-elect Trump not putting his tax returns, Corker said. But thats not going to change the way we go about our committee process.  Senate Democrats believe they can fight miniature versions of the political battles they are waging with Trump during the confirmation hearings for his Cabinet choices  particularly those such as Tillerson who hail from the private sector. They intend to focus on Tillersons four-decade career at a major oil conglomerate and what they  and some Republicans  see as questionable ties to Russian President Vladimir Putin. Several Democratic members of the committee have said they also plan to ask Tillerson about human rights and climate change in light of his Exxon work.  Many lawmakers are leaning on Trump to fully divest from his companies because his wide-ranging business empire lends itself at the very least to an appearance of conflicts of interest. Democrats argue Tillersons business career raises similar questions.  Just how thorny those conflicts may be wont be clear until the committee receives Tillersons financial disclosure statements, documents that Corker expects to have before the end of 2016. Corker plans to give other committee members a copy of the disclosure as soon as we have it, providing ample time to review what is expected to be a very extensive document.  Committee Democrats are planning to scour Tillersons financials once they receive them and are exploring options to beef up their resources by borrowing tax and financial experts from other corners of the Hill or seconding Internal Revenue Service and Treasury Department employees to help, according to an aide.  The all-in effort is vital, they argue, because unlike many previous secretaries of state, Tillerson has not had to publicize details about his personal finances. If confirmed, Tillerson would be the first secretary of state in decades who has not previously worked as a public servant or a member of the military.  This proposed nominee for secretary of state will likely be asked more questions than normal. Secretary Kerry was somebody that we knew. Secretary Clinton was somebody that we knew, Corker said. Since [Tillerson] will be up under the hood advising the president on foreign policy, a president who hasnt been involved in foreign policy in his business life, we certainly want to understand fully the kind of advice he would be giving the president as secretary of state.  Part of the logic behind planning a two-part hearing (one session in the morning and one in the afternoon), as Corker put it, is so there can be plenty, plenty, plenty of time for people to learn everything they want to from Tillerson.  A particular point of concern for Democrats and Republicans will be Tillersons relationship and business dealings with Putin, who awarded him the Kremlins Order of Friendship in 2013. Tillerson also opposed sanctions that the United States imposed on Russia in 2014 as a reaction to the annexation of Crimea and Moscows support of separatists in eastern Ukraine, arguing that Exxon lost $1 billion from the policy change.  On Thursday, Corker had a 30-minute conversation with Tillerson in which he questioned him about Russia, with the bulk of that conversation focusing on sanctions. He came away with the impression that Tillerson had no interest in ripping up existing sanctions on Russia, even if he criticized them as Exxons CEO.  That would be hugely problematic to this one senator, if I felt that was how we were going to begin the relations with Russia, Corker said, referring to himself. He noted the conversation alleviated some of the concerns he harbored about Tillersons relationship with the Kremlin.  Corker said he encouraged Tillerson to start calling other lawmakers on his committee. Tillerson and lead Foreign Relations Committee Democrat Ben Cardin (Md.) also spoke by phone Thursday, but a spokesman for Cardin would not detail what was discussed.  On Tuesday, Tillerson was in Washington, where he met with Sen. Tom Cotton (R-Ark.), who endorsed his nomination. He hopes to meet with as many senators as possible to discuss his nomination, according to the Trump transition team.  I think, at least I hope, that when these meetings take place that were going to see a Rex Tillerson that has a standard view of Russias malicious activities, nefarious activities, Corker said. I got a good sense of how hed [approach] Russia and Putin, and it was certainly different, if you will, than the picture of him toasting Putin with champagne.  Several key GOP senators  including John McCain (Ariz.), Lindsey Graham (S.C.) and Marco Rubio (Fla.)  have expressed concerns that Tillersons ties to Russia could be a dangerous echo of Trumps seeming affinity for Putin. Those concerns have taken on even more urgency in wake of CIA allegations that Russia attempted to tilt the election to Trump.  Since the president-elect selected Tillerson, Trumps transition team has been rolling out foreign policy heavyweights such as Bob Gates, Condoleezza Rice, Stephen Hadley and Dick Cheney to vouch for Tillersons global bona fides. Gates, Rice and Hadley run a consulting firm that has Exxon is a client.  Only one Republican on the Foreign Relations Committee  Rubio  has publicly criticized Tillerson over his Kremlin ties, and he communicated those concerns directly to Corker before the nomination was formally announced.  Democrats need only persuade one Republican to oppose Tillerson to block his nomination in committee. But it is still possible he could get to a floor vote even if the committee rejects him. In the past, the Senate Foreign Relations Committee has reported out nominations unfavorably, a procedure that expresses the members discontent without blocking the full Senate from voting. In 1983, the full Senate confirmed President Ronald Reagans Arms Control and Disarmament Agency nominee, Kenneth Adelman, despite his rejection by the panel.  But Corker expressed confidence that Tillerson would pass the committees test, even if his track record as an oil-company CEO gives members pause.  My sense is, based on the conversation we had, hes going to very much understand that his job now is to pursue our countrys national interest, Corker said."
76,Real,"Obamacare Has Its Biggest Day as Republicans Promise Repeal A record number of Americans signed up for Obamacare Thursday on what they thought would be the last day to enroll in health insurance coverage that starts in the new year, President Barack Obama said Friday.  So many people visited the federal government website that the administration extended the deadline until early next week to give more people time to sign up for what could be the last year of Obamacare coverage.  The Republicans who will control Congress and the White House starting next month say they'll repeal the law that provides the insurance markets as soon as they can  although there's no clear plan for how, when or what to put in its place.  Obama plugged the health insurance marketplace, the centerpiece of the 2010 Affordable Care Act, in his last press conference of the year before heading to Hawaii for vacation.  ""Yesterday was the biggest day ever for Healthcare.gov. More than 670,000 Americans signed up to get coverage,"" Obama said.  ""SINCE I SIGNED OBAMACARE INTO LAW, OUR BUSINESSES HAVE ADDED MORE THAN 15 MILLION NEW JOBS."" That's compared to 600,000 sign-ups last year on the Dec. 15 deadline.  Obama said when he took office, 44 million Americans lacked health insurance. ""Today, we have covered more than 20 million of them,"" he said. ""For the first time in history, more than 90 percent of Americans are insured.""  Republican opponents of Obamacare don't dispute the coverage numbers but say the law has failed to bring down costs for consumers, as had been promised.  Related: Most Americans Don't Want Obamacare Repealed  Premiums have risen as insurance companies taking part in the exchanges have struggled to make the profits they seek given the other restrictions imposed by the law. Obamacare limits the ability to charge higher premiums for women and older people, and it forces insurers to take all comers, even people who are already sick.  But the publicity over higher premiums didn't seem to scare off new customers. The Department of Health and Human Services said more than 4 million people have signed up for coverage on Healthcare.gov, compared to about 2.8 million enrollments by the first week of December last year. That includes 1.1 million people not covered before and 2.9 million renewals.  ""YESTERDAY WAS BIGGEST DAY EVER FOR HEALTHCARE.GOV. MORE THAN 670,000 AMERICANS SIGNED UP TO GET COVERAGE."" Most people who buy private insurance on the health insurance marketplaces get a hefty federal subsidy to help pay the premiums. An analysis by the Center for Health and Economy found those subsidies would cost $42.6 billion next year, an increase of nearly $10 billion over this year.  Related: Obamacare Repeal Would Take Insurance from 30 Million People  The enrollment numbers do not include 12 health insurance marketplaces run by states and Washington, D.C. independently of the federal government.  The new demand could help improve profitability for insurers, said Larry Levitt of the nonpartisan Kaiser Family Foundation. ""If the current (Affordable Care Act) open enrollment period is successful and enrollment grows, it means the insurance market is not collapsing,"" he said via Twitter.  ""Because of the extraordinary demand, we extended the deadline to sign-up for January 1 coverage by two business days until 11:59 pm PST December 19. We don't yet know how many people will take advantage of this extension, but nearly a million consumers left their contact information to hold their place in line,"" HHS said in a statement.  Obama on Friday took a shot at critics who said the law would hurt business and employment by requiring larger employers to cover their workers.  ""Since I signed Obamacare into law, our businesses have added more than 15 million new jobs,"" he said."
77,Satire,"Senator tells ethics commissioner she was unaware that she was a Senator for 7 years OTTAWA  Conservative Senator Nicole Eaton claimed Thursday that she was unaware of her appointment to the Senate some seven years ago, in addition to claiming that she was did not know she was a director of an offshore corporation in the Bahamas some twelve years ago.  This is a simple misunderstanding, one that Im sure happens to many Canadians, explained Eaton told the press while attending a fundraiser gala for slightly less wealthy children. I dont recall ever being told I was an Officer of Parliament. I know this Harper fellow vaguely, and I thought I was signing up for one of those European cruises on Parliament Hill. I really leave that appointment business to my accountants and lawyers.  Eaton claims that it was her close friend from her fine-art collecting club, simply known as Muffy, who submitted her name to the Prime Ministers Officer for a position in the Upper Chamber.  Somehow she placed my name on these Senate documents at the ceremony and took the oath for me. I had absolutely no idea what the devil she was signing me up for. I thought she was adding another Van Gogh for my collection.  The Harper-appointed Senator, most famous for demanding the audit of environmental charities, calling Canadas national symbol a dentally defective rat, and attempting to frame Roger Rabbit, promptly reported to Senate Ethics Commissioner Mary Dawson that she was oblivious to the fact that the debates and committees she attended over the last seven years had anything to do with the Senate.  I thought I was at the bridge club, it was so dull there. Fortunately, we only had to sit for half the year.  Eaton says that she will wait for more information from the Offshore Leaks Database to discover if she is director of another offshore company, or was appointed a Senator position in another country."
78,Real,"Trump picks budget 'hawk' Mick Mulvaney to lead budget office President-elect Donald Trump has nominated Mick Mulvaney, a conservative Republican congressman from South Carolina who is known as a budget hawk, as director of the Office of Management and Budget.  In a statement issued on Saturday morning  shortly after Trump tweeted an inflammatory comment about Chinas seizure of a US navy drone in the South China Sea  Trump called Mulvaney a very high-energy leader with deep convictions for how to responsibly manage our nations finances and save our country from drowning in red ink.  Trump also said that with Mulvaney as his budget director, his administration would make smart choices and renew the American taxpayers trust in how their money is spent.  Mulvaney said he would help restore budgetary and fiscal sanity  after eight years of an out-of-control, tax-and-spend financial agenda under Barack Obama.  Like other Trump nominations, the budget directors job requires Senate approval.  Mulvaneys nomination follows a pattern of Trump turning to individuals with records apparently hostile to the agencies they are nominated to lead.  For example, the Oklahoma attorney general, Scott Pruitt, a leading critic of climate change theories, has been nominated to lead the Environmental Protection Agency.  In other such moves, the billionaire and charter schools advocate Betsy DeVos has been nominated as education secretary and the Alabama senator Jeff Sessions, a critic of voting rights legislation, has been nominated as attorney general.  The announcement about Mulvaney was made as Trump, who takes office on 20 January, began his holiday vacation at Mar-a-Lago, his oceanfront club in Palm Beach, Florida.  Mulvaney, 49, was an outspoken critic of the former House speaker John Boehner, who resigned in 2015 amid opposition from fellow Republicans who were members of the House Freedom Caucus.  His selection points to a strategy by Trump to cut government where he can. The president-elect has recently railed against what he has called a far too expensive new version of the Air Force One aircraft he will use, which Boeing is supposed to build.  With Mick at the head of OMB, Trump said in his statement, my administration is going to make smart choices about Americas budget, bring new accountability to our federal government, and renew the American taxpayers trust in how their money is spent.  Mulvaney said: Each day, families across our nation make disciplined choices about how to spend their hard-earned money, and the federal government should exercise the same discretion that hard-working Americans do every day, he said.  On Friday night, Trump vowed to seek approval from Congress for $1tn in new spending to rebuild the countrys crumbling network of roads, bridges, airports and other infrastructure as a way to create jobs and make some needed repairs.  We are going to fix our country. Its time. We have no choice. Its time, Trump said at a rally in Orlando, Florida."
79,Satire,"PUTIN APPEARS WITH TRUMP IN FLURRY OF SWING-STATE RALLIES TAMPA (The Borowitz Report)Infused with a sense of urgency as Election Day nears, the Trump campaign has enlisted President Vladimir Putin, of Russia, to appear with the Republican nominee in a dizzying array of swing-state rallies over the weekend.  Putin will be the most visible Trump surrogate in the final weekend of the campaign, as he tries to fire up voters in Florida, North Carolina, Colorado, and Nevada.  The Russian President seemed to relish the warm response he got at his first Trump rally, in Tampa, where he led the crowd in a raucous chant of Lock her up.  Trump praised Putins talent for politics by noting that he had won the Russian election in 2012 by a landslide. He got sixty-four per cent of the vote, and no one else even came close, Trump said. Hes terrific.  Putin, whose English is rudimentary at best, kept his remarks brief at the Tampa rally, but echoed Melania Trumps recent call for an end to bullying.  A Republican strategist, Harland Dorrinson, called the Trump campaigns use of Putin in crucial battleground states very, very smart.  At this point, you really couldnt ask for a more effective surrogate, he said. Youd much rather see Trump up there with Putin than with, say, Chris Christie.  While some in the media criticized the Trump campaign for allowing Putin to influence the outcome of a U.S. election, the Republican nominees campaign manager, Kellyanne Conway, pushed back in an appearance on CNN.  This is just another case of media bias against Donald Trump, she said. Jay Z and Beyonc, who have no experience in government at all, are allowed to campaign for Hillary Clinton, but Vladimir Putin, who actually runs an entire country, cant appear with Donald Trump? Come on."
