,label,content
109,Satire,"NATION UNSURE IT CAN TOLERATE THIRTEEN MORE DAYS OF RUDY GIULIANI NEW YORK (The Borowitz Report)With thirteen days until his scheduled return to oblivion, many Americans are unsure if they can tolerate that much additional exposure to Rudy Giuliani, a leading psychologist said on Wednesday.  As millions of Americans actively count down the days until Giuliani disappears forever, thirteen more days of him seems like a lifetime, Davis Logsdon, a psychologist who has been studying the Giuliani ordeal, said.  Americans traumatic experience of Rudy Giuliani in 2016 has gone through several phases, Logsdon said. First, they struggled to remember who he was. Then, once they remembered, they recoiled in horror. Finally, they began actively wishing he would go away forever. That is the phase many people find themselves in today.  Even as they long for the day when Giuliani resumes his rightful place in obscurity, many Americans are experiencing feelings of anger and disbelief that he was permitted to crawl back into their consciousness to begin with, Logsdon said. Of the many inexcusable things that cable news has done this election, repeatedly subjecting Americans to Rudy Giuliani is at the top of the list, he said. The human cost has been enormous.  As they struggle to endure the final thirteen days of Rudy Giuliani, Americans should not feel isolated or alone, Logsdon said. They need to know that there are millions of people just like them, and even more who are unsure if they can stand another thirteen days of Kellyanne Conway, he said."
110,Fake,"99% of Americans Didnt Spot CRAZY Thing That Happened THE SECOND Trump Won Primaries! Right after Donald Trump won the primary and caucus voting on Tuesday night, Donald Trump delivered a victory speech where he made an effort to reach out to voters that supported other candidates. He especially targeted Bernie Sanders supporters.  TO THOSE WHO VOTED FOR SOMEONE ELSE, IN EITHER PARTY, I WILL WORK HARD TO EARN YOUR SUPPORT, AND I WILL WORK VERY HARD TO EARN THAT SUPPORT, TRUMP DECLARED.  TO ALL OF THOSE BERNIE SANDERS VOTERS WHO HAVE BEEN LEFT OUT IN THE COLD BY A RIGGED SYSTEM OF SUPERDELEGATES, WE WELCOME YOU WITH OPEN ARMS, HE PROCLAIMED  Trump then mentioned all the terrible deals that Sanders has been shouting about since he announced his campaign. He said that he would get rid of those deals in order to protect American workers. This is how Trump will save America. He will not sell us out.   The media has worked hard to stop people from seeing what has been happening, Trump has been pulling the disillusioned Democrats that have already seen the light. They see that the America is getting crapped on by the rest of the world.  *** Its good to see that even hardcore Democrats hate Hillary Clinton as much as Trump Nation does. One Bernie Supporter named Juanita Mae Ish Poloskey wrote the following on Facebook:  SUPER! WE NEED BERNIES VOTERS TO COME TO TRUMP! I WAS A DEMOCRAT ALL MY LIFE, THIS YEAR I BELIEVE TRUMP IS THE ONLY PERSON WHO CAN GET AMERICA BACK!!!  Another Bernie supporter wrote: I and a bunch of Bernie supporters will be voting Trump this November. I refuse to vote for someone who sells the American people out to foreign entities.  That last comment received more than 8,751 likes in only a couple of hours.  Another Democrat named Mac Zeff wrote: My family hast traditionally been Democrats. We are voting TRUMP this time around. If Hillary is the best the Democrats can produce for the working class, its time to disband the Democrat party.  *** Things are not looking good for Hillary Clinton.  Share this story everywhere. If you know any Bernie supporters, share this with them. Show them that there are millions of Americans out there like them that want America to be greater. Welcome aboard the Trump Train. (h/t Conservative Tribune)"
111,Satire,"Karnataka minister who was caught watching obscene pictures claims he was reading TOI online Bengaluru: Recently one Karnataka minister was caught watching obscene pictures during Tipu Jayanti celebration. This has given opposition BJP a chance to corner ruling congress which made a lot of hue and cry few years back when BJP ministers were caught doing the same inside assembly.  TOIJust browsing TOI Like the old BJP ministers, the Karnataka minister has denied the allegations strongly. First of all, why I would watch such stuff on a 5-inch smartphone, when I have an iMac with 100 mbps dedicated internet line at home, said the minister with an angry tone while speaking to us.  The minister added, There is no time for people like me to read newspapers. While attending functions, if I get some time, instead of sleeping on the dais, I go through some online newspapers.  Probably when I was going through TOI (The Online India), some mischievous journalist took the video and shared with opposition and news channels. My question to all my detractors, where it is written, one cannot read a widely circulated daily like TOI when you are at public places. In fact, I would say it was an off day for the newspaper by its own high standard. There was hardly anything for excitement, said the minister.  The minister said, If these people are so concerned, what our kids are learning from this, then let them bring certain level of censorship. For some pages they can easily do an adult check in online version, through GPS they can track the place from where one is accessing and put a warning i.e. to watch such stuffs, go to your private area immediately. Even better, they can ask newspaper to bring a separate edition only for private viewing, oops sorry, private reading by adults only.  The minister also showed us the requests he has got from his colleagues cutting across party lines to share the link."
112,Fake,"Ted Cruz: I Will Endorse Donald Trump For President If He Makes Masturbation Illegal WASHINGTON, D.C. (AP)  U.S. Sen. Ted Cruz (R-Texas) sent shockwaves through the Republican Party today when he announced that he would endorse Donald Trump for President, but only if the GOP nominee would be willing to publicly support a ban on masturbation. The Senator called this The single most important issue facing the country today and that without swift action by the next President the country was doomed to slide down a slippery slope of debauchery and self-satisfaction.    Self-love is a silent killer in this country. This needless act of hedonistic indulgence is leading our children down a dark and destructive path. It starts innocently enough with a JC Penney catalogue tucked under your mattress, but it quickly spirals out of control, and before you know it, your mother has to call the coroner because youve died from auto-erotic asphyxiation. Im not saying that we should lock up these one armed bandits and throw away the key; what we need is a compassionate approach that helps these deviants reform and become productive members of society. That is why I believe a prison sentence of three to five years will help motivate these heathens to change their evil ways and stay off the Devils playground for good, Cruz said. Im asking Mr. Trump to acknowledge the severity of this problem, and commit to finding real solutions. If he does that, I will do whatever it takes to help him secure the White House in November. Should Mr. Trump decline, I think its safe to say that all options, including a third party run, are out on the table.  Donald Trump told ABC News that he was open to the idea, though he refused to take a clear stand on the issue.  Look, do I think Ted Cruz is right about this? Maybe he is, maybe he isnt. To be honest, I dont know a lot about this subject matter. I dont need to. I have a wife that takes care of this for me, and shes a beautiful wife, the best wife, the greatest wife. My people are going to take a hard look into this matter and find a great answer for it, the best answer there is. I want an endorsement from Senator Cruz, and I think I can go along with his request that makes pleasuring your genitalia for non-reproductive purposes illegal.  This is not the first time that Cruz has attempted to use his political power to curtail the act of self-stimulation. As solicitor general of Texas in 2007 he fought to uphold the states ban on sex toys by arguing that there was no Right to stimulate ones genitals. Cruz eventually lost this battle, but the story re-surfaced this year and gained widespread media attention, prompting Cruzs former college roommate Craig Mazin to tweet that Cruzs stance against stimulating ones own genitals was A new belief of his, implying that much of Cruzs time in college was, in fact, spent stimulating his own genitals. Another one of Cruzs former college roommates, Matt Daemon, has recently come forward to corroborate Mazins story.  All Ted Cruz did was take care of little Ted Cruz back then, which is fine I guess, but he was always real creepy about doing it. Honestly, I lost track of the number of times I came home to find him laying on the couch naked, lotion and Kleenex next to him, watching re-runs of Walker Texas Ranger. He wouldnt even try and cover up when I caught him, he would just stare at me in the eyes and continue until I left the room. Its absolutely hilarious about the tough stance on touching ones self that Ted has taken in this country. I truly believe he may have pulled on it one too many times and it broke or something and now feels that if he cant do it anymore, then no one can.    Sarah Bradley, a spokeswoman for Sock It Forward, a group that provides the homeless and those less fortunate with brand new socks, told ABC News that she is sickened by the Republican party.  It is absolutely disgusting that in this day in age, a creepy weirdo like Ted Cruz was almost elected as the GOP nomination for President, Bradley said. With all the real problems in this country like starvation, so many people out of work and families living on the street, Cruz is focused on making pleasuring yourself a crime. Bradley continued, Also, I just want to say a big thank you to everyone that has supported our cause in giving new socks to the homeless, it means so much. Please, donate what you can, every bit helps.  Cruz, however, remains undeterred by his detractors. When you play with your Devil stick or ring the Devils doorbell you make the angels in heaven weep, and they are weeping for this country 24 hours a day, 7 days a week. America needs strong moral leadership, and I pray that Donald Trump is up to the task. The fate of our great nation is in his hands; hopefully, theyre big enough to handle it.  Most pundits expect Trump to answer Cruzs call and demand a stiffer approach to the matter. A recent poll by the New York Times found that 43% of likely Trump voters support a ban on self-stimulation due to moral and religious concerns. Another 46% would be okay with a ban, saying that they, like Trump, have far too many potential suitors, and therefore do not need to satisfy their own urges. Only 11% of Trump supporters are against a ban.  RNC political strategist, 37-year-old Paul Horner, calls the move a no-brainer and says that Trump would be foolish to turn his back on Cruz.  Conservatives are siding with Cruz overwhelmingly on this issue. If Donald does not side with the Senator, he risks alienating the partys Christian base and opening the door for a third party run by Cruz which would fracture the vote and all but guarantee a victory for Clinton. Trump needs to agree with Cruz on this one, no matter how creepy, insane and absolutely horrible of a person he is.  David Mikkelson, founder of Snopes.com, a website known for its biased opinions and inaccurate information they write about stories on the internet in order to generate advertising revenue, told ABC News that he approves of what a story like this is accomplishing.  You have to understand that when a story like this goes viral, and we spend a minute or two debunking it, we make lots of money. Stories like this have helped put my children through college, buy a new car, a home and even get the gender reassignment surgery my wife Barbara has always wanted since she was a little boy, Mikkleson said. We claim to provide evidence for such debunkings and confirmation as well, but thats just ridiculous. Do you know how much time that would take? Instead, we just copy and paste parts of the original article into ours, write a couple sentences, and thats it. I just want to be clear, our website does zero journalism or anything creative, and Im only telling you this for legal reasons. For example, do you remember that recent article we wrote debunking a story which claimed Scientology lost its tax-exempt status? Did you actually read our story? Who is the name of the person responsible for the hoax? What is the actual website URL? We claim to know it, but no real information is posted by us. Mikkelson continues, It is common for us to rewrite a story were debunking if we dont like it. In one recent story of ours, we actually removed a persons name from the original article and then called him a liar, oh the hypocrisy, but it is so funny at the same time! We also like to post fake, un-funny, juvenile disclaimers supposedly from the site in question and it is our authors, such as Jeff Zarronandia who are responsible for those gems. We tell our readers that the disclaimer is from the story we are debunking, but a simple google search that locates the actual article will show that our disclaimer is 100% fabricated. Sometimes I think that someone should start a company that debunks our debunkings, they could probably make a lot of money, Mikkelson laughs. And lots of people complain about our authors attacking websites and their owners for reasons that are 100% proven false, but since we block archive.org it just becomes their word versus ours. Plus, I know for our writers like Kim LaCapria, it is way more fun for them to cause controversy than report the facts; it results in more visitors. Kim LaCapria and Jeff Zarronandia go as far as accusing the site that the story originated from as a clickbait fake news site that infringes the trademark-protected visual elements and domain names of legitimate news outlets in order to generate traffic and drive advertising revenues by creating and spreading entirely false news stories. The thing that is troubling about these claims and what Snopes and our authors are known for. We dont list ONE factual piece of evidence to back up any of our claims; Its just more of our hack, unethical journalism, and I only tell you this for legal reasons. I think it is business as usual for us to accuse the story we are debunking of spreading malware and viruses, but we never say what website it actually is. I think warning people about a site that could potentially destroy their computer is probably a good idea, and I hope one day to do that kind of ethical journalism, but people will click our ads regardless, bottom line; so why do the extra work? To be honest, Id say in a given week I probably only do about fifteen minutes of real, actual, work.  Regardless of which side Trump takes on the issue, it is certain to invoke heated debate on both sides of the political aisle. You can voice your opinion about Cruzs proposal by calling the Senators 24-Hour No Self-Love Hotline at (785) 273-0325."
113,Fake,"REPORT: Nine ISIS Supporters Arrested Near Washington D.C. At least nine individuals have been arrested in Northern Virginia for attempting to support ISIS since the group rose to power in 2014, according to a report from law enforcement officials.  According to the report, which was obtained by The Washington Times, the nine individuals were arrested for providing or attempting to provide support to ISIS and included a police officer and several U.S. Army soldiers.  The Washington Times reports:  Law enforcement agencies have arrested nine Northern Virginia residents on charges of aiding the Islamic State since the terrorist group rose to power in Syria and Iraq in 2014 and launched social media propaganda to attract followers, a government message to police states.    Of the nine Northern Virginians who were arrested, all but one were in their teens and early 20s. They included a police officer, a Starbucks barista, Army soldiers, bankers and a cabdriver. Four of the nine graduated from Northern Virginia high schools, one with honors. Two attended Northern Virginia Community College.  According to the Times, one of the men, a U.S. army combat engineer named Mohammad Bilor Jalloh, attempted to purchase firearms in an attempt to carry out a Fort Hood style attack.  Another man, Metro police officer Nicholas Young, traveled to Libya and gave advice to Islamic State followers on how to avoid law enforcement monitoring according to law enforcement officials.  Several others planned on creating online propaganda for the terror group, with one seeking to encourage lone wolf style attacks on Washington DC.  The report raises new concerns about the reach of the terror group into the U.S. homeland, and any future plans to import new refugees from troubled Muslim nations.  If you havent checked out and liked our Facebook page, please go here and do so."
