,label,content
33,Real,"Will Trump's plan mean faster rate hikes? The Federal Reserve is virtually certain to raise interest rates this week for the first time this year, but the course of future hikes has suddenly become cloudier.  The Fed has signaled for many weeks that it plans to hoist its key rate by a quarter percentage point at a two-day meeting that begins Tuesday, and futures markets say theres a 93% chance it will follow through.  Meanwhile, President-elect Donald Trumps fiscal stimulus proposals may ultimately require faster rate increases to head off inflation, while other byproducts of his plan could slow the economy and prompt the Fed to act more cautiously.  For now, economists dont expect Fed policymakers to weigh such hypotheticals as they draft their quarterly projections for rate increases over the next few years. Even so, with unemployment falling rapidly and inflation finally picking up, Fed officials likely are no longer inclined to call for slower rate hikes over the long-term, as they have in each of their previous forecasts this year amid headwinds such as weak productivity growth, economists say.   Unemployment is falling toward levels that are arguably below stable inflation, says Tim Duy, a University of Oregon economics professor and author of the Fedwatch blog.  Yet he says the Fed will almost certainly reiterate that rate increases will be gradual.  In November, the jobless rate dropped to 4.6% from 4.9% the previous month. Thats already below the 4.8% that the Fed has deemed the lowest average rate sustainable without generating excessive inflation, or rapid price increases that decrease consumers' purchasing power and especially hurt savers and those on fixed incomes. Low unemployment typically pushes up wages as employers compete for fewer available workers, and price increases typically follow as the firms scramble to maintain profit margins.  That doesnt mean persistently low inflation is poised to suddenly spike.While an inflation measure closely monitored by the Fed rose from 1.2% to 1.4% annually in October as the effects of low gasoline prices faded, thats well below the Feds 2% target.  Still, it was the fastest pace in two years. And annual wage growth hit a seven-year high in October and has climbed steadily since early 2015 in a further signal that inflation is firming, Barclays economist Michael Gapen wrote in a note to clients.  In September, Fed Chair Janet Yellen noted that discouraged workers on the sidelines were streaming back into the labor force, keeping the unemployment rate elevated and providing the economy more room to run without stoking inflation. But the labor force shrank in both October and November, giving the Fed another reason to make a move this week and stick with its previous forecast of two rate hikes next year and three in 2018.  If you were to wait any longer, you would risk getting behind the curve, says JPMorgan Chase economist Michael Feroli. The Fed held off on rate increases earlier this year in response to Chinas slowdown and a sluggish U.S. economy, among other factors.  The future roadmap is fuzzier. Trump has proposed a $1 trillion plan to upgrade the nations infrastructure and sharp tax cuts, a stimulus package that, if passed by Congress, could fuel inflation and force the Fed to lift rates more rapidly.  But, Its probably too early for the Fed to incorporate any fiscal policy issues into their forecast, Duy says. Its similarly too soon, he says, to anticipate  negative economic fallout from Trumps restrictive trade proposals.  On the other hand, the prospect of more federal spending and faster economic growth and inflation under Trump already has strengthened the dollar and pushed up long-term interest rates. Those developments tend to crimp the economy by hurting U.S. exports and discouraging consumer and business borrowing.  If they were to persist or intensify next year, the Fed may raise rates more gradually than anticipated, especially if the faster growth portended by Trumps plan hasnt yet materialized, Feroli says."
34,Fake,"BREAKING: Washington Post Just Caught Red Handed in MASSIVE Fake News Scandal!! This is really one of those funny, beautiful moments in history when a big, old, and unreliable news source like the Washington Post gets caught red handed in their own web of lies.  You see, just last week the Washington Post published an article in which they claimed to have an actual list of news companies that work for Vladimir Putin. Well, surprise, surprise, that all turned out to be a big old load of CRAP!  Today the Post was forced to add new notes to that article which essentially read that their list was crap and the source they claimed was reliable is actually just a bunch of Liberal morons.   Screenshot of editors note admitting that Washington Post published an unverified Fake News list. Their source was an anonymous website called PropOrNot which said they had a obtained a list of people directly employed by Russia or idiots that repeat Russian Propaganda.  The beautiful irony is that the only website dumb enough to actually believe their list was the Washington Post. Do you know why? Because they are nothing but scam artists.  Let me break this down plain and simple for you folks. WaPo and other old news sources lost all of their Trust when they lied about the election this year. Of course, the problem goes even further back to when they LIED about Nukes being in Iraq.    Now, these big papers are losing money and scared of becoming irrelevant. They are trying to freak out the public with all sorts of lies about their competitors just to save their own asses. SHAME ON THEM! (H/T  Daily Mail)  Trump is luckily fighting back, but its important that regular folks like you and I do our best to get this information shared everywhere so we can end the reign of the LYING mainstream media once-and-for-all!!"
35,Fake,"Moments After Being Briefed on Berlin Attack, Obama Hops on Golf Cart President Obama headed to a golf course moments after receiving reports that a truck had plowed through a Christmas market in Berlin in a potential terrorist attack, according to White House pool reports.  Obama, who is vacationing in Hawaii for the holidays, was also briefed by his national security team on the assassination of Russias ambassador to Turkey just before departing for the Mid-Pacific Country Club.  White House press liaison Eric Schultz wrote in a memo that Obama left his rental vacation home at 10:21 a.m. HST, or 3:21 p.m. EST, after a press van held at the house for 11 minutes awaiting the president.  Spectators on the street threw shakas and recorded photos or video on cell phones as the motorcade made the 10-minute drive to Mid-Pacific Country Club, where the president will be golfing under cloudy skies, Schultz wrote, according to Mediate.  Nine people were killed and at least 50 others were injured in the Berlin truck attack. Police believe the incident was deliberate.  Russia, meanwhile, declared the killing of Ambassador Andrey Karlov in Ankara an act of terrorism.  The president has faced scrutiny for his decisions to golf during crises.  In August, the former FEMA Director Michael Brown, who oversaw the federal response to Hurricane Katrina in 2005, condemned Obama for continuing to golf during his two-week vacation on Marthas Vineyard while historic floods were devastating parts of Louisiana."
36,Real,"Rex Tillerson: an appointment that would confirm Putin's US election win If Rex Tillerson is nominated as the next secretary of state, it would confirm Vladimir Putin as one of the strategic victors of the US presidential election.  Barack Obama has ordered an inquiry into covert Russian intervention in the campaign, which the CIA says was designed to secure a victory for Donald Trump. But whether or not Russian intervention made a significant difference to the outcome, a Tillerson appointment would represent a significant gain for Moscow.  While the other leading candidates for the job hold largely traditional and adversarial views on Russia, the outgoing chief executive of Exxon Mobil has a history of close business ties to Putin, who bestowed the Order of Friendship on Tillerson in 2013.  The Wall Street Journal reported: Friends and associates said few US citizens are closer to Mr Putin than Mr Tillerson.  The 64-year-old Texas oilman spent much of his career working on Russian deals, including a 2011 agreement giving Exxon Mobil access to the huge resources under the Russian Arctic in return for giving the giant state-owned Russian oil company, OAO Rosneft, the opportunity to invest in Exxon Mobils operations overseas.  Tillerson is also friends with the head of Rosneft, Igor Sechin, a former interpreter who worked as chief of staff for Putin when he was deputy mayor in St Petersburg in the mid-1990s. Sechin, sometimes described as the second-most-powerful man in Russia, is now under US sanctions. He has said that one of his ambitions is to ride the roads in the United States on motorcycles with Tillerson.  The 2011 Exxon-Rosneft agreement was frozen when sanctions were imposed on Russia in 2014, following the annexation of Crimea and covert military intervention in eastern Ukraine. Exxon Mobil estimated the sanctions cost it $1bn and Tillerson has argued strenuously for the measures to be lifted.  Trumps choice suggests he wants to make good on his promise to cut deals with Russia instead of containing it Thomas Wright, Brookings Institution We always encourage the people who are making those decisions to consider the very broad collateral damage of who are they really harming with sanctions, he said, at a shareholders meeting.  In June, two years after sanctions were imposed and in an apparent show of support for Sechin, Tillerson reportedly turned up at a St Petersburg economic summit.  If the sanctions were lifted, the Arctic project would probably go ahead and Tillersons retirement fund of Exxon Mobil stock would increase in value. He would most likely have to divest himself of stock by the time he entered the office on the seventh floor of the state department. It might be harder to divorce his judgments entirely from the oil company where he spent his career.  Trumps choice of Rex Tillerson suggests he wants to make good on his promise to cut deals with Russia instead of containing it, said Thomas Wright, who has written extensively on Trumps foreign policy at the Brookings Institution.   Tillerson has a relationship with Putin and he opposed the sanctions imposed on Russia after the annexation of Crimea. This will alarm those worried about Russian intentions in Europe.  Praising Tillerson in an interview with Fox News Sunday, Trump said: To me a great advantage is that he knows many of the players in the world and he knows them well.  Lest there be any doubt about which players the president-elect had in mind, Trump added: He does massive deals in Russia not for himself, but for the company.  A culture of intimidation Stacks and burn-off from the Exxon Mobil refinery, at dusk in St Bernard Parish, Louisiana. Facebook Twitter Pinterest Stacks and burn-off from the Exxon Mobil refinery, at dusk in St Bernard Parish, Louisiana. Photograph: Gerald Herbert/AP In a very real sense, Tillerson has been a head of a state within a state. Exxon Mobil is bigger economically than many countries. It has its own foreign policy and its own contracted security forces.  As a state, it has much in common with the one run by Putin and Sechin.  Reporting on Exxon was not only harder than reporting on the Bin Ladens, it was harder than reporting on the CIA by an order of magnitude, said Steve Coll, who wrote about the company in a book, Private Empire.  They have a culture of intimidation that they bring to bear in their external relations, and it is plenty understood inside the corporation too. They make people nervous, they make people afraid, Coll, now a journalism professor at Columbia University, told Texas Monthly.  Running the state department would not be like running Exxon Mobil, however. For a start, Tillerson would have to audition in front of a sceptical Senate. On Saturday, leading Democrats were painting him as a Moscow stooge.  The New Jersey senator Bob Menendez said on Twitter: Rex Tillerson as secretary of state would guarantee Russia has a willing accomplice in the presidents cabinet.  With a slim 52-48 majority, it would only take three Republican senators in revolt to cast Tillersons job in doubt. He would face aggressive questioning from Republican foreign policy hawks, led by John McCain.  I have obviously concerns about his relationship with Vladimir Putin, who is a thug and a murderer, but obviously we will have hearings on that issue and other issues concerning him will be examined and then its the time to make up your mind on whether to vote yes or no, the Arizona senator told CNN on Saturday.  A US foreign policy based on realpolitik rather than on values would be a disaster for Russia Andrei Kozyrev, former Russian foreign minister McCains former chief of staff, Mark Salter, was far more blunt on Twitter. Tillerson would sell out Nato for Sakhalin oil and his pal, Vlad, he wrote. Should be a rough confirmation hearing, and a no vote on the Senate floor.  Even if Tillerson were to be confirmed, he would not take over the state department with a free hand to rewrite policy. He would face a striking culture clash with the institution, the bastion of foreign policy orthodoxy, which would have an ally in the secretary of defence nominee, retired general James Mattis, who is likely to oppose any erosion of Nato solidarity in the face of Moscows assertiveness in Europe.  Nevertheless, Dmitri Trenin, director of the Carnegie Endowment Moscow Center, argued: Tillerson as secretary of state would signify the greatest discontinuity in US foreign policy since the end of the cold war.  Not just in US-Russian relations: a Trump-Tillerson foreign policy would be squarely focused on US national interests, rather than on its global pretensions or any ideology.  Trenin added: It would be hard-nosed and no-nonsense, not averse to the use of force, but in response to a real rather than imaginary threat. In one word: realist.  That is a change that would be undoubtedly be welcomed by Putin, whose vision of foreign policy centres on spheres of interest controlled by global powers, run by strongmen like himself.  Andrei Kozyrev, a former Russian foreign minister, argued that the Kremlin should be careful what it wishes for.  The paradoxical situation now is that Russia is hoping for a US foreign policy based on realpolitik rather than on values, but that would be a disaster for Russia, said Kozyrev, who is now at the Wilson Center thinktank in Washington.  Why? Because the only interest America has in ending the conflicts in eastern Ukraine  or in Syria is actually in American values  that America should be concerned and do everything to alleviate the humanitarian situation and they should help nations to find their path to democracy.  The realpolitik situation is that Russia is stuck in both military conflicts. If you look at this with a cold eye, you say: Let them go on and let them enjoy the disaster they have in eastern Ukraine, Kozyrev said.  Look at Syria. By realpolitik the Americans would rather sit and wait while Russia draws on its resources and gets into bloody conflict."
37,Real,"Feds: Pension Exec Moved $2B for Coke, Hookers, Other Bribes A former top official at the country's third-largest pension fund and two broker-dealers were charged Wednesday in what a federal prosecutor described as a classic bribery scheme that steered $2 billion in trades in exchange for drugs, prostitutes, vacations and U.S. Open tennis tickets.  ""The hard-earned pension savings of New Yorkers should never serve as a vehicle for corrupt, personal enrichment,"" Manhattan U.S. Attorney Preet Bharara said in a statement, calling the alleged pay-for-play arrangement a ""classic, quid-pro-quo bribery scheme.""  Navnoor Kang, the ex-head of the $184 billion New York State Common Retirement Fund's fixed income trades, received more than $100,000 worth of bribes in the form of trips, gifts, luxury hotel stays and other payoffs from broker-dealers Deborah Kelley and Gregg Schonhorn, prosecutors said.  Kang, 38, was arrested in Portland, Oregon, on securities fraud, honest service wire fraud, conspiracy and obstruction of justice charges.  His attorney, Lauren DeSantis-Then, said her client denies all the charges.  ""Mr. Kang is not guilty and we look forward to our day in court,"" she said.  Kelley, 58, of Piedmont, California, was expected to surrender, authorities said. Her attorney didn't immediately return a request for comment.  Schonhorn, 45, of Short Hills, New Jersey, has pleaded guilty and is cooperating with federal authorities, court papers show. His lawyer didn't immediately return a request for comment.  Regulators found that Kang steered about $2 billion in fixed-income trades to firms represented by Kelley and Schonhorn beginning in early 2014, resulting in millions of dollars in commissions, of which the two earned between 35 and 40 percent, according to an indictment.  In that time, securities investigators found that the firms' fixed-income business surged, with one of them increasing its domestic bond transactions from zero at the end of fiscal year 2013 to $2.378 billion at the end of fiscal year 2016, making it one of the top broker dealers doing state pension fund business, according to the complaint.  Prosecutors said that in exchange, Kang received a $10,000 all-expenses-paid trip to Montreal, Canada; a ski trip to Park City, Utah; tickets to a Paul McCartney concert in New Orleans; a $17,420 Panerai wristwatch; dinners at upscale restaurants; nights out at strip clubs; prostitutes; and cocaine.  The state's pension fund has been the source of scandal before.  In 2010, a state comptroller pleaded guilty to charges he steered pension funds to a campaign contributor. Further investigations revealed investors' widespread use of so-called placement agents to access pension funds, an arrangement some regulators have likened to pay-to-play.  Kang had been fired in 2012 by a private investment firm for accepting gifts from Schonhorn in exchange for steering fixed-income business, but he lied about his termination when he was hired by the state fund, according to the complaint.  Asked whether state officials properly investigated Kang before hiring him, a spokesman for the comptroller's office said only that ""background checks are a routine part of the hiring process."""
38,Real,"No Government Shutdown: Senate Passes Funding Bill After Democrats Back Down Senate Democrats dropped their objections Friday night to a short-term-funding bill to keep the government running, and the bill passed less than an hour before the midnight deadline.  It's become a familiar year-end act for Congress: passing a short-term-funding bill that will keep the government running for a few more months. This funding measure, which passed 63-36, runs out in April.  Despite overwhelming support in the House on Thursday, the spending package hit a roadblock in the Senate, where coal state Democrats staged a late protest to try to alter provisions affecting miners.  The stopgap includes $45 million to continue health benefits for four months for certain retired coal miners, whose coverage was set to expire at the end of the year. Democrats, led by West Virginia's Joe Manchin, wanted a full-year extension, but with little leverage and a shutdown looming, they relented with a promise to reignite that fight in four months.  ""Would I have preferred that provision to be more generous? Of course I would have,"" said Senate Majority Leader Mitch McConnell. ""But we'll be back at it in April, and I think it's highly unlikely that we'll take it away.""  With House lawmakers already back home for the holidays on Friday  and zero interest from GOP leaders to reopen negotiations  Democrats backed down in time to avert a midnight Friday shutdown.  The spending bill keeps the federal government running on autopilot until April 28. Congressional Republicans opted to punt the annual spending bills into next year to wait until President-elect Donald Trump assumes office. With control of both the White House and Congress, Republicans will have more sway over how roughly $1 trillion is spent on federal agencies and programs.  The bill runs through April to buy Congress more time to negotiate the fiscal year 2017 spending bills, because the Senate is expected to be consumed by the confirmation process for Trump administration nominees in the first quarter of next year.  Since the spending bill is a must-pass measure, it also includes some unrelated provisions and additional funding measures. For instance, Senate Republicans included language that will help expedite the confirmation process for Trump's defense secretary nominee, retired Gen. James Mattis.  For Mattis to be confirmed, Congress must waive a law that requires a seven-year cooling-off period for current or former military officials to hold that Cabinet post. Mattis retired in 2013.  Democrats objected to the language, but Republicans said it was necessary to expedite consideration of a critical administration post. The waiver will still be reviewed by the House and Senate Armed Services Committees, and it will need to pass a 60-vote threshold in the Senate.  Mattis has been widely praised on both sides of the aisle and is expected to be confirmed, barring something unforeseen coming to light during the confirmation process.  The measure also includes just over $10 billion in Overseas Contingency Funding, better known as the side Pentagon account that funds the ongoing war efforts in Iraq and Afghanistan.  An additional $4.1 billion is directed to disaster relief, including recovery efforts from Hurricane Matthew.  Democrats also secured funding to assist the Flint, Mich., community with repairing its drinking water systems. Some $170 million is directed toward infrastructure improvements and preventive care against lead poisoning for mothers and children.  Congress approved a biomedical research bill this week, and the stopgap spending measure includes funds for new programs authorized in the legislation, such as $352 million to the National Institutes of Health for medical research and $500 million to states to combat the opioid epidemic.  The measure also includes a provision that will prevent a pay raise for members of Congress. The pay freeze has been in place since 2010."
